{
  "build_provenance": {
    "dependencies": {
      "docling": "2.113.0",
      "docling-core": "2.87.1",
      "jsonschema": "4.26.0",
      "markitdown": "0.1.6"
    },
    "generator_id": "tools.generate_refinement_fixtures",
    "lockfile_sha256": "2a06114acb4804c445ff5d562123c7ef9930f86d18bf98d6d51fb615e40f5cca",
    "package_version": "0.5.0",
    "provenance_id": "f27bf80e8a5c17a5ea7567ccdca6335d955f09a616ac4ec750567a1e98715f04",
    "python": {
      "implementation": "CPython",
      "major_minor": "3.12"
    }
  },
  "fixtures": [
    {
      "expected_rules": [
        "TCW-D010"
      ],
      "id": "line-end-hyphenation",
      "license": "CC0-1.0",
      "path": "fixtures/refinement/v0.5/line-end-hyphenation.docx",
      "sha256": "1bd24261bd55336037a23e9254ac8fc20638d8b5d5af243c8c5aea83d96682db",
      "size": 34464
    },
    {
      "expected_rules": [
        "TCW-D009"
      ],
      "id": "whitespace-cleanup",
      "license": "CC0-1.0",
      "path": "fixtures/refinement/v0.5/whitespace-cleanup.md",
      "sha256": "c960009a8c64e0e85da79b361bb968e83ea08ba75847e9d8103c370d024f7b43",
      "size": 323
    }
  ],
  "generator": "tools/generate_refinement_fixtures.py",
  "schema_version": "tcw.refinement-fixture-registry/v0.5"
}
